08:30:00.000001 IP 206.200.127.138.49653 > 233.54.12.111.26477: UDP, length 57
08:30:00.000004 IP 206.200.127.138.49653 > 233.54.12.111.26477: UDP, length 94
08:30:00.000006 IP 206.200.127.138.49653 > 233.54.12.111.26477: UDP, length 57
08:30:00.000016 IP 206.200.127.138.49653 > 233.54.12.111.26477: UDP, length 57
08:30:00.000027 IP 206.200.127.138.49653 > 233.54.12.111.26477: UDP, length 94
08:30:00.000028 IP 206.200.127.138.49653 > 233.54.12.111.26477: UDP, length 57
08:30:00.000030 IP 206.200.127.138.49653 > 233.54.12.111.26477: UDP, length 57
08:30:00.000031 IP 206.200.127.138.49653 > 233.54.12.111.26477: UDP, length 57
08:30:00.000034 IP 206.200.127.138.49653 > 233.54.12.111.26477: UDP, length 57
08:30:00.000036 IP 206.200.127.138.49653 > 233.54.12.111.26477: UDP, length 94
08:30:00.000039 IP 206.200.127.138.49653 > 233.54.12.111.26477: UDP, length 57
08:30:00.000041 IP 206.200.127.138.49653 > 233.54.12.111.26477: UDP, length 57
08:30:00.000043 IP 206.200.127.138.49653 > 233.54.12.111.26477: UDP, length 57
08:30:00.000050 IP 206.200.127.138.49653 > 233.54.12.111.26477: UDP, length 57
08:30:00.000052 IP 206.200.127.138.49653 > 233.54.12.111.26477: UDP, length 57
08:30:00.000054 IP 206.200.127.138.49653 > 233.54.12.111.26477: UDP, length 62
08:30:00.000059 IP 206.200.127.138.49653 > 233.54.12.111.26477: UDP, length 58
08:30:00.000059 IP 206.200.127.138.49653 > 233.54.12.111.26477: UDP, length 41
08:30:00.000066 IP 206.200.127.138.49653 > 233.54.12.111.26477: UDP, length 94
08:30:00.000068 IP 206.200.127.138.49653 > 233.54.12.111.26477: UDP, length 57
08:30:00.000071 IP 206.200.127.138.49653 > 233.54.12.111.26477: UDP, length 94
08:30:00.000073 IP 206.200.127.138.49653 > 233.54.12.111.26477: UDP, length 94
08:30:00.000077 IP 206.200.127.138.49653 > 233.54.12.111.26477: UDP, length 78
08:30:00.000079 IP 206.200.127.138.49653 > 233.54.12.111.26477: UDP, length 95
08:30:00.000083 IP 206.200.127.138.49653 > 233.54.12.111.26477: UDP, length 94
08:30:00.000084 IP 206.200.127.138.49653 > 233.54.12.111.26477: UDP, length 57
08:30:00.000086 IP 206.200.127.138.49653 > 233.54.12.111.26477: UDP, length 62
08:30:00.000087 IP 206.200.127.138.49653 > 233.54.12.111.26477: UDP, length 41
08:30:00.000090 IP 206.200.127.138.49653 > 233.54.12.111.26477: UDP, length 57
08:30:00.000092 IP 206.200.127.138.49653 > 233.54.12.111.26477: UDP, length 57
08:30:00.000094 IP 206.200.127.138.49653 > 233.54.12.111.26477: UDP, length 94
08:30:00.000096 IP 206.200.127.138.49653 > 233.54.12.111.26477: UDP, length 57
08:30:00.000100 IP 206.200.127.138.49653 > 233.54.12.111.26477: UDP, length 53
08:30:00.000108 IP 206.200.127.138.49653 > 233.54.12.111.26477: UDP, length 57
08:30:00.000109 IP 206.200.127.138.49653 > 233.54.12.111.26477: UDP, length 57
08:30:00.000114 IP 206.200.127.138.49653 > 233.54.12.111.26477: UDP, length 131
08:30:00.000117 IP 206.200.127.138.49653 > 233.54.12.111.26477: UDP, length 57
08:30:00.000120 IP 206.200.127.138.49653 > 233.54.12.111.26477: UDP, length 57
08:30:00.000122 IP 206.200.127.138.49653 > 233.54.12.111.26477: UDP, length 57
08:30:00.000125 IP 206.200.127.138.49653 > 233.54.12.111.26477: UDP, length 94
08:30:00.000129 IP 206.200.127.138.49653 > 233.54.12.111.26477: UDP, length 57
08:30:00.000132 IP 206.200.127.138.49653 > 233.54.12.111.26477: UDP, length 131
08:30:00.000133 IP 206.200.127.138.49653 > 233.54.12.111.26477: UDP, length 58
08:30:00.000136 IP 206.200.127.138.49653 > 233.54.12.111.26477: UDP, length 57
08:30:00.000139 IP 206.200.127.138.49653 > 233.54.12.111.26477: UDP, length 94
08:30:00.000143 IP 206.200.127.138.49653 > 233.54.12.111.26477: UDP, length 62
08:30:00.000145 IP 206.200.127.138.49653 > 233.54.12.111.26477: UDP, length 57
08:30:00.000148 IP 206.200.127.138.49653 > 233.54.12.111.26477: UDP, length 95
08:30:00.000152 IP 206.200.127.138.49653 > 233.54.12.111.26477: UDP, length 57
08:30:00.000154 IP 206.200.127.138.49653 > 233.54.12.111.26477: UDP, length 41
08:30:00.000170 IP 206.200.127.138.49653 > 233.54.12.111.26477: UDP, length 78
08:30:00.000239 IP 206.200.127.138.49653 > 233.54.12.111.26477: UDP, length 34
08:30:00.000249 IP 206.200.127.138.49653 > 233.54.12.111.26477: UDP, length 58
08:30:00.000259 IP 206.200.127.138.49653 > 233.54.12.111.26477: UDP, length 413
08:30:00.000262 IP 206.200.127.138.49653 > 233.54.12.111.26477: UDP, length 224
08:30:00.000266 IP 206.200.127.138.49653 > 233.54.12.111.26477: UDP, length 117
08:30:00.000272 IP 206.200.127.138.49653 > 233.54.12.111.26477: UDP, length 214
08:30:00.000284 IP 206.200.127.138.49653 > 233.54.12.111.26477: UDP, length 41
08:30:00.000290 IP 206.200.127.138.49653 > 233.54.12.111.26477: UDP, length 41
08:30:00.000293 IP 206.200.127.138.49653 > 233.54.12.111.26477: UDP, length 58
08:30:00.000301 IP 206.200.127.138.49653 > 233.54.12.111.26477: UDP, length 209
08:30:00.000308 IP 206.200.127.138.49653 > 233.54.12.111.26477: UDP, length 134
08:30:00.000313 IP 206.200.127.138.49653 > 233.54.12.111.26477: UDP, length 207
08:30:00.000321 IP 206.200.127.138.49653 > 233.54.12.111.26477: UDP, length 342
08:30:00.000330 IP 206.200.127.138.49653 > 233.54.12.111.26477: UDP, length 399
08:30:00.000342 IP 206.200.127.138.49653 > 233.54.12.111.26477: UDP, length 477
08:30:00.000350 IP 206.200.127.138.49653 > 233.54.12.111.26477: UDP, length 364
08:30:00.000359 IP 206.200.127.138.49653 > 233.54.12.111.26477: UDP, length 267
08:30:00.000367 IP 206.200.127.138.49653 > 233.54.12.111.26477: UDP, length 269
08:30:00.000375 IP 206.200.127.138.49653 > 233.54.12.111.26477: UDP, length 306
08:30:00.000383 IP 206.200.127.138.49653 > 233.54.12.111.26477: UDP, length 359
08:30:00.000391 IP 206.200.127.138.49653 > 233.54.12.111.26477: UDP, length 319
08:30:00.000396 IP 206.200.127.138.49653 > 233.54.12.111.26477: UDP, length 132
08:30:00.000400 IP 206.200.127.138.49653 > 233.54.12.111.26477: UDP, length 192
08:30:00.000407 IP 206.200.127.138.49653 > 233.54.12.111.26477: UDP, length 269
08:30:00.000413 IP 206.200.127.138.49653 > 233.54.12.111.26477: UDP, length 154
08:30:00.000417 IP 206.200.127.138.49653 > 233.54.12.111.26477: UDP, length 231
08:30:00.000434 IP 206.200.127.138.49653 > 233.54.12.111.26477: UDP, length 72
08:30:00.000440 IP 206.200.127.138.49653 > 233.54.12.111.26477: UDP, length 96
08:30:00.000441 IP 206.200.127.138.49653 > 233.54.12.111.26477: UDP, length 58
08:30:00.000446 IP 206.200.127.138.49653 > 233.54.12.111.26477: UDP, length 117
08:30:00.000455 IP 206.200.127.138.49653 > 233.54.12.111.26477: UDP, length 267
08:30:00.000504 IP 206.200.127.138.49653 > 233.54.12.111.26477: UDP, length 58
08:30:00.000512 IP 206.200.127.138.49653 > 233.54.12.111.26477: UDP, length 96
08:30:00.000514 IP 206.200.127.138.49653 > 233.54.12.111.26477: UDP, length 96
08:30:00.000525 IP 206.200.127.138.49653 > 233.54.12.111.26477: UDP, length 58
08:30:00.000528 IP 206.200.127.138.49653 > 233.54.12.111.26477: UDP, length 96
08:30:00.000530 IP 206.200.127.138.49653 > 233.54.12.111.26477: UDP, length 58
08:30:00.000537 IP 206.200.127.138.49653 > 233.54.12.111.26477: UDP, length 230
08:30:00.000547 IP 206.200.127.138.49653 > 233.54.12.111.26477: UDP, length 58
08:30:00.000548 IP 206.200.127.138.49653 > 233.54.12.111.26477: UDP, length 58
08:30:00.000555 IP 206.200.127.138.49653 > 233.54.12.111.26477: UDP, length 134
08:30:00.000557 IP 206.200.127.138.49653 > 233.54.12.111.26477: UDP, length 158
08:30:00.000559 IP 206.200.127.138.49653 > 233.54.12.111.26477: UDP, length 95
08:30:00.000563 IP 206.200.127.138.49653 > 233.54.12.111.26477: UDP, length 96
08:30:00.000567 IP 206.200.127.138.49653 > 233.54.12.111.26477: UDP, length 131
08:30:00.000569 IP 206.200.127.138.49653 > 233.54.12.111.26477: UDP, length 58
08:30:00.000571 IP 206.200.127.138.49653 > 233.54.12.111.26477: UDP, length 124
08:30:00.000576 IP 206.200.127.138.49653 > 233.54.12.111.26477: UDP, length 58
08:30:00.000638 IP 206.200.127.138.49653 > 233.54.12.111.26477: UDP, length 58
